{
  "cache": {
    "ddgs_ttl_seconds": 86400,
    "note": "DDGS-backed retrieval may use the local cache; direct sources are not cached by the fan-out orchestrator.",
    "policy": "source_default"
  },
  "execution": {
    "deadline_enforced": true,
    "deadline_seconds": 12.0,
    "duration_ms": 11546.452,
    "llm_required": false,
    "mode": "parallel",
    "rerank_requested": false
  },
  "query": "SQLite vector search extension sqlite-vec USearch",
  "result_count": 12,
  "results": [
    {
      "rank": 1,
      "score": null,
      "snippet": "sqlite-vec is a new vector search SQLite extension written entirely in C with no dependencies, MIT/Apache-2.0 dual licensed. The first \"stable\" v0.1.0 release is here, meaning that it is ready for folks to try in their own projects!",
      "sources": [
        "ddg"
      ],
      "title": "Introducing sqlite-vec v0.1.0: a vector search SQLite extension that...",
      "url": "https://alexgarcia.xyz/blog/2024/sqlite-vec-stable-release/index.html"
    },
    {
      "rank": 2,
      "score": null,
      "snippet": "An extremely small, \"fast enough\" vector search SQLite extension that runs anywhere! A successor to sqlite-vss.sqlite-lembed, Generate text embeddings locally from embedding models in the .gguf format. About. A vector search SQLite extension that runs anywhere!",
      "sources": [
        "ddg"
      ],
      "title": "GitHub - asg017/sqlite-vec: A vector search SQLite extension that...",
      "url": "https://github.com/asg017/sqlite-vec/"
    },
    {
      "rank": 3,
      "score": null,
      "snippet": "A vector search SQLite extension that runs anywhere!SQLite-Vector is a cross-platform, ultra-efficient SQLite extension that brings vector search capabilities to your embedded database.",
      "sources": [
        "ddg"
      ],
      "title": "USearch Alternatives and Reviews",
      "url": "https://www.libhunt.com/r/USearch"
    },
    {
      "rank": 4,
      "score": null,
      "snippet": "5 pts | 2 comments | by marcobambini",
      "sources": [
        "hn"
      ],
      "title": "Show HN: SQLite-vector \u2013 Vector search extension for SQLite (no index, 30MB RAM)",
      "url": "https://news.ycombinator.com/item?id=44711872"
    },
    {
      "rank": 5,
      "score": null,
      "snippet": "314 pts | 43 comments | by brylie",
      "sources": [
        "hn"
      ],
      "title": "Sqlite-vec: Work-in-progress vector search SQLite extension that runs anywhere",
      "url": "https://news.ycombinator.com/item?id=41137658"
    },
    {
      "rank": 6,
      "score": null,
      "snippet": "40 pts | 2 comments | by Tiberium",
      "sources": [
        "hn"
      ],
      "title": "SQLite-vec v0.1.0: a vector search SQLite extension that runs everywhere",
      "url": "https://news.ycombinator.com/item?id=41127849"
    },
    {
      "rank": 7,
      "score": null,
      "snippet": "\u2b50 7901 | A vector search SQLite extension that runs anywhere!",
      "sources": [
        "github"
      ],
      "title": "asg017/sqlite-vec",
      "url": "https://github.com/asg017/sqlite-vec"
    },
    {
      "rank": 8,
      "score": null,
      "snippet": "\u2b50 1998 | A SQLite extension for efficient vector search, based on Faiss!",
      "sources": [
        "github"
      ],
      "title": "asg017/sqlite-vss",
      "url": "https://github.com/asg017/sqlite-vss"
    },
    {
      "rank": 9,
      "score": null,
      "snippet": "\u2b50 1021 | SQLite-Vector is a cross-platform, ultra-efficient SQLite extension that brings vector search capabilities to your embedded database.",
      "sources": [
        "github"
      ],
      "title": "sqliteai/sqlite-vector",
      "url": "https://github.com/sqliteai/sqlite-vector"
    },
    {
      "rank": 10,
      "score": null,
      "snippet": "Vector data is prevalent across business and scientific applications, and its popularity is growing with the proliferation of learned embeddings. Vector data collections often reach billions of vector",
      "sources": [
        "arxiv"
      ],
      "title": "Toward Efficient and Scalable Design of In-Memory Graph-Based Vector Search",
      "url": "https://arxiv.org/abs/2509.05750v1"
    },
    {
      "rank": 11,
      "score": null,
      "snippet": "Relevance is a foundation of user experience in e-commerce search. We view relevance optimization as a closed-loop ecosystem involving multiple human roles: users who provide feedback, product manager",
      "sources": [
        "arxiv"
      ],
      "title": "A Case-Driven Multi-Agent Framework for E-Commerce Search Relevance",
      "url": "https://arxiv.org/abs/2605.05991v1"
    },
    {
      "rank": 12,
      "score": null,
      "snippet": "A vector balleans is a vector space over $\\mathbb{R}$ endowed with a coarse structure in such a way that the vector operations are coarse mappings. We prove that, for every ballean $(X, \\mathcal{E})$,",
      "sources": [
        "arxiv"
      ],
      "title": "A note on free vector balleans",
      "url": "https://arxiv.org/abs/1812.01848v2"
    }
  ],
  "retrieved_at": "2026-07-18T08:59:27.560920Z",
  "schema_version": "supersearch.search.v1",
  "sources": [
    {
      "diagnostics": [],
      "name": "ddg",
      "result_count": 3,
      "status": "completed"
    },
    {
      "diagnostics": [],
      "name": "hn",
      "result_count": 3,
      "status": "completed"
    },
    {
      "diagnostics": [],
      "name": "github",
      "result_count": 3,
      "status": "completed"
    },
    {
      "diagnostics": [],
      "name": "arxiv",
      "result_count": 3,
      "status": "completed"
    }
  ],
  "status": "ok"
}
