{
  "cache": {
    "ddgs_ttl_seconds": 86400,
    "note": "DDGS-backed retrieval may use the local cache; direct sources are not cached by the fan-out orchestrator.",
    "policy": "source_default"
  },
  "execution": {
    "deadline_enforced": false,
    "deadline_seconds": 12.0,
    "duration_ms": 2352.304,
    "llm_required": false,
    "mode": "serial",
    "rerank_requested": false
  },
  "query": "RFC 9116 security.txt well-known path",
  "result_count": 9,
  "results": [
    {
      "rank": 1,
      "score": null,
      "snippet": "The standard prescribes a text file named security.txt in the well known location, similar in syntax to robots.txt but intended to be machine and human readable, for those wishing to contact a website's owner about security issues.",
      "sources": [
        "ddg"
      ],
      "title": "security.txt - Wikipedia",
      "url": "https://en.wikipedia.org/wiki/Security.txt"
    },
    {
      "rank": 2,
      "score": null,
      "snippet": "If a \"security.txt\" file is present in both locations, the one in the \"/.well- known/\" path MUST be used. The file MUST be accessed via HTTP 1.0 or a higher version, and the file access MUST use the \"https\" scheme (as per Section 2.7.2 of [RFC7230]).",
      "sources": [
        "ddg"
      ],
      "title": "RFC 9116: A File Format to Aid in Security Vulnerability ...",
      "url": "https://www.rfc-editor.org/info/rfc9116/"
    },
    {
      "rank": 3,
      "score": null,
      "snippet": "When a security researcher finds a potential vulnerability on your site, their first step is typically to look for a security.txt file. They check /.well-known/security.txt and /security.txt.",
      "sources": [
        "ddg"
      ],
      "title": "security.txt: The RFC 9116 Standard Explained \u2014 SecureScanr",
      "url": "https://securescanr.com/learn/security-txt-guide"
    },
    {
      "rank": 4,
      "score": null,
      "snippet": "\u2b50 1 | Scan domain lists for `/.well-known/security.txt` and validate files against RFC 9116.",
      "sources": [
        "github"
      ],
      "title": "vavkamil/rfc9116-check",
      "url": "https://github.com/vavkamil/rfc9116-check"
    },
    {
      "rank": 5,
      "score": null,
      "snippet": "\u2b50 1 | RFC 9116 security.txt parser, validator, and serializer for TypeScript and JavaScript.",
      "sources": [
        "github"
      ],
      "title": "ivan-podgurskiy/security-txt-parser",
      "url": "https://github.com/ivan-podgurskiy/security-txt-parser"
    },
    {
      "rank": 6,
      "score": null,
      "snippet": "\u2b50 2 | Recon tool for pentesters & bug bounty hunters: check robots.txt, security.txt (RFC 9116) and /.well-known/ across many targets. CLI + web UI, single static Go binary.",
      "sources": [
        "github"
      ],
      "title": "11lunaric11/securitychecker",
      "url": "https://github.com/11lunaric11/securitychecker"
    },
    {
      "rank": 7,
      "score": null,
      "snippet": "Complex monopole configurations dominate in the path integral in the Georgi-Glashow-Chern-Simons model and disorder the Higgs vacuum. No cancellation is expected among Gribov copies of the monopole co",
      "sources": [
        "arxiv"
      ],
      "title": "Complex Monopoles in the Path Integral",
      "url": "https://arxiv.org/abs/hep-th/9809072v1"
    },
    {
      "rank": 8,
      "score": null,
      "snippet": "Adapting ideas of Daubechies and Klauder we derive a continuum path-integral formula for the time evolution generated by a spin Hamiltonian. For this purpose we identify the finite-dimensional spin Hi",
      "sources": [
        "arxiv"
      ],
      "title": "A rigorous path-integral formula for quantum-spin dynamics via planar Brownian motion",
      "url": "https://arxiv.org/abs/quant-ph/9810069v1"
    },
    {
      "rank": 9,
      "score": null,
      "snippet": "The performance optimization of UAV communication systems requires the joint design of UAV trajectory and communication efficiently. To tackle the challenge of infinite design variables arising from t",
      "sources": [
        "arxiv"
      ],
      "title": "UAV Trajectory and Communication Co-design: Flexible Path Discretization and Path Compression",
      "url": "https://arxiv.org/abs/2010.07068v1"
    }
  ],
  "retrieved_at": "2026-10-24T06:51:19.762582Z",
  "schema_version": "supersearch.search.v1",
  "sources": [
    {
      "diagnostics": [],
      "name": "ddg",
      "result_count": 3,
      "status": "completed"
    },
    {
      "diagnostics": [],
      "name": "hn",
      "result_count": 0,
      "status": "completed"
    },
    {
      "diagnostics": [],
      "name": "github",
      "result_count": 3,
      "status": "completed"
    },
    {
      "diagnostics": [],
      "name": "arxiv",
      "result_count": 3,
      "status": "completed"
    }
  ],
  "status": "ok"
}
