{
  "cache": {
    "ddgs_ttl_seconds": 86400,
    "note": "DDGS-backed retrieval may use the local cache; direct sources are not cached by the fan-out orchestrator.",
    "policy": "source_default"
  },
  "execution": {
    "deadline_enforced": false,
    "deadline_seconds": 12.0,
    "duration_ms": 3448.865,
    "llm_required": false,
    "mode": "serial",
    "rerank_requested": false
  },
  "query": "SQLite vector search extension sqlite-vec USearch",
  "result_count": 9,
  "results": [
    {
      "rank": 1,
      "score": null,
      "snippet": "5 pts | 2 comments | by marcobambini",
      "sources": [
        "hn"
      ],
      "title": "Show HN: SQLite-vector \u2013 Vector search extension for SQLite (no index, 30MB RAM)",
      "url": "https://news.ycombinator.com/item?id=44711872"
    },
    {
      "rank": 2,
      "score": null,
      "snippet": "314 pts | 43 comments | by brylie",
      "sources": [
        "hn"
      ],
      "title": "Sqlite-vec: Work-in-progress vector search SQLite extension that runs anywhere",
      "url": "https://news.ycombinator.com/item?id=41137658"
    },
    {
      "rank": 3,
      "score": null,
      "snippet": "40 pts | 2 comments | by Tiberium",
      "sources": [
        "hn"
      ],
      "title": "SQLite-vec v0.1.0: a vector search SQLite extension that runs everywhere",
      "url": "https://news.ycombinator.com/item?id=41127849"
    },
    {
      "rank": 4,
      "score": null,
      "snippet": "\u2b50 8209 | A vector search SQLite extension that runs anywhere!",
      "sources": [
        "github"
      ],
      "title": "asg017/sqlite-vec",
      "url": "https://github.com/asg017/sqlite-vec"
    },
    {
      "rank": 5,
      "score": null,
      "snippet": "\u2b50 2005 | A SQLite extension for efficient vector search, based on Faiss!",
      "sources": [
        "github"
      ],
      "title": "asg017/sqlite-vss",
      "url": "https://github.com/asg017/sqlite-vss"
    },
    {
      "rank": 6,
      "score": null,
      "snippet": "\u2b50 1194 | SQLite-Vector is a cross-platform, ultra-efficient SQLite extension that brings vector search capabilities to your embedded database.",
      "sources": [
        "github"
      ],
      "title": "sqliteai/sqlite-vector",
      "url": "https://github.com/sqliteai/sqlite-vector"
    },
    {
      "rank": 7,
      "score": null,
      "snippet": "This work introduces scrydb, a Python library that enables lexical, semantic, and hybrid search within SQLite. For lexical search, scrydb leverages SQLite's full-text search extension FTS5. Semantic s",
      "sources": [
        "arxiv"
      ],
      "title": "SQLite is Enough. Lexical, Semantic, and Hybrid Search with scrydb",
      "url": "https://arxiv.org/abs/2608.24060v1"
    },
    {
      "rank": 8,
      "score": null,
      "snippet": "Vector data is prevalent across business and scientific applications, and its popularity is growing with the proliferation of learned embeddings. Vector data collections often reach billions of vector",
      "sources": [
        "arxiv"
      ],
      "title": "Toward Efficient and Scalable Design of In-Memory Graph-Based Vector Search",
      "url": "https://arxiv.org/abs/2509.05750v1"
    },
    {
      "rank": 9,
      "score": null,
      "snippet": "Relevance is a foundation of user experience in e-commerce search. We view relevance optimization as a closed-loop ecosystem involving multiple human roles: users who provide feedback, product manager",
      "sources": [
        "arxiv"
      ],
      "title": "A Case-Driven Multi-Agent Framework for E-Commerce Search Relevance",
      "url": "https://arxiv.org/abs/2605.05991v1"
    }
  ],
  "retrieved_at": "2026-10-24T06:51:16.060984Z",
  "schema_version": "supersearch.search.v1",
  "sources": [
    {
      "diagnostics": [
        "Error searching: No results found."
      ],
      "name": "ddg",
      "result_count": 0,
      "status": "failed"
    },
    {
      "diagnostics": [],
      "name": "hn",
      "result_count": 3,
      "status": "completed"
    },
    {
      "diagnostics": [],
      "name": "github",
      "result_count": 3,
      "status": "completed"
    },
    {
      "diagnostics": [],
      "name": "arxiv",
      "result_count": 3,
      "status": "completed"
    }
  ],
  "status": "partial"
}
