{
  "cache": {
    "ddgs_ttl_seconds": 86400,
    "note": "DDGS-backed retrieval may use the local cache; direct sources are not cached by the fan-out orchestrator.",
    "policy": "source_default"
  },
  "execution": {
    "deadline_enforced": false,
    "deadline_seconds": 12.0,
    "duration_ms": 15868.471,
    "llm_required": false,
    "mode": "serial",
    "rerank_requested": false
  },
  "query": "RFC 9116 security.txt well-known path",
  "result_count": 9,
  "results": [
    {
      "rank": 1,
      "score": null,
      "snippet": "This document defines a machine-parsable format (\"security.txt\") to help organizations describe their vulnerability disclosure practices to make it easier for researchers to report vulnerabilities.",
      "sources": [
        "ddg"
      ],
      "title": "RFC 9116: A File Format to Aid in Security Vulnerability... | RFC Editor",
      "url": "https://www.rfc-editor.org/info/rfc9116/"
    },
    {
      "rank": 2,
      "score": null,
      "snippet": "known/security.txt as per [RFC8615] of a domain name or IP address. For legacy compatibility, a \"security.txt\" file might be placed at. the top-level path or redirect (as per Section 6.4 of [RFC7231]) to.",
      "sources": [
        "ddg"
      ],
      "title": "security-txt/rfc9116.txt at master \u00b7 securitytxt/security-txt \u00b7 GitHub",
      "url": "https://github.com/securitytxt/security-txt/blob/master/rfc9116.txt"
    },
    {
      "rank": 3,
      "score": null,
      "snippet": "A security.txt file \u00b7 a plain-text file at /.well-known/security.txt \u00b7 gives them that path. It is a small, standardized file defined by RFC 9116, and adding one is one of the cheapest security wins you can ship this week. What Happens When a Researcher Finds a Bug and Can't Reach You?",
      "sources": [
        "ddg"
      ],
      "title": "security.txt Explained (RFC 9116): Let Researchers... | SimplyScan",
      "url": "https://simplyscan.io/blog/security-txt-guide"
    },
    {
      "rank": 4,
      "score": null,
      "snippet": "\u2b50 2 | Recon tool for pentesters & bug bounty hunters: check robots.txt, security.txt (RFC 9116) and /.well-known/ across many targets. CLI + web UI, single static Go binary.",
      "sources": [
        "github"
      ],
      "title": "11lunaric11/securitychecker",
      "url": "https://github.com/11lunaric11/securitychecker"
    },
    {
      "rank": 5,
      "score": null,
      "snippet": "\u2b50 1 | An Astro integration that generates RFC 9116 compliant security.txt files during build.",
      "sources": [
        "github"
      ],
      "title": "dirsigler/astro-securitytxt",
      "url": "https://github.com/dirsigler/astro-securitytxt"
    },
    {
      "rank": 6,
      "score": null,
      "snippet": "\u2b50 1 | GitHub Action that updates Expires in .well-known/security.txt (RFC 9116) to keep published security contact metadata current",
      "sources": [
        "github"
      ],
      "title": "octivi/update-securitytxt-expires",
      "url": "https://github.com/octivi/update-securitytxt-expires"
    },
    {
      "rank": 7,
      "score": null,
      "snippet": "Complex monopole configurations dominate in the path integral in the Georgi-Glashow-Chern-Simons model and disorder the Higgs vacuum. No cancellation is expected among Gribov copies of the monopole co",
      "sources": [
        "arxiv"
      ],
      "title": "Complex Monopoles in the Path Integral",
      "url": "https://arxiv.org/abs/hep-th/9809072v1"
    },
    {
      "rank": 8,
      "score": null,
      "snippet": "Adapting ideas of Daubechies and Klauder we derive a continuum path-integral formula for the time evolution generated by a spin Hamiltonian. For this purpose we identify the finite-dimensional spin Hi",
      "sources": [
        "arxiv"
      ],
      "title": "A rigorous path-integral formula for quantum-spin dynamics via planar Brownian motion",
      "url": "https://arxiv.org/abs/quant-ph/9810069v1"
    },
    {
      "rank": 9,
      "score": null,
      "snippet": "The performance optimization of UAV communication systems requires the joint design of UAV trajectory and communication efficiently. To tackle the challenge of infinite design variables arising from t",
      "sources": [
        "arxiv"
      ],
      "title": "UAV Trajectory and Communication Co-design: Flexible Path Discretization and Path Compression",
      "url": "https://arxiv.org/abs/2010.07068v1"
    }
  ],
  "retrieved_at": "2026-07-18T08:59:53.618613Z",
  "schema_version": "supersearch.search.v1",
  "sources": [
    {
      "diagnostics": [],
      "name": "ddg",
      "result_count": 3,
      "status": "completed"
    },
    {
      "diagnostics": [],
      "name": "hn",
      "result_count": 0,
      "status": "completed"
    },
    {
      "diagnostics": [],
      "name": "github",
      "result_count": 3,
      "status": "completed"
    },
    {
      "diagnostics": [],
      "name": "arxiv",
      "result_count": 3,
      "status": "completed"
    }
  ],
  "status": "ok"
}
